{
  "schemaVersion": 2,
  "gameDomain": "re-engine",
  "displayName": "RE Engine Games",
  "engine": "RE Engine",
  "aliases": [
    "residentevilrequiem",
    "residentevil4",
    "residentevil2",
    "residentevil3",
    "residentevil7",
    "residentevilvillage",
    "dmc5",
    "mhrise",
    "dragonsdogma2"
  ],
  "detection": {
    "executableCandidates": ["re4.exe", "re2.exe", "re3.exe", "re8.exe", "dmc5.exe"],
    "steamAppIds": [2050650, 883710, 952060, 1196590, 601150]
  },
  "rootFolders": [
    "natives",
    "reframework",
    "autorun",
    "reshade-shaders",
    "mods",
    "plugins",
    "scripts"
  ],
  "rootFiles": [
    "dinput8.dll",
    "dxgi.dll",
    "opengl32.dll",
    "openvr_api.dll",
    "xinput1_3.dll",
    "xinput1_4.dll",
    "bink2w64.dll",
    "sl.dlss.dll",
    "sl.fsr3.dll",
    "sl.common.dll"
  ],
  "routingRules": [],
  "deployment": {
    "preferredMethod": "hardlink",
    "fallback": "copy"
  },
  "installRules": {
    "allowRootFallback": false,
    "forbiddenPaths": ["saves"],
    "maxFileCount": 30000,
    "maxEntryBytes": 805306368
  }
}
